id,speaker,headline,URL,description,transcript_URL,month_filmed,year_filmed,event,duration,date_published,views_as_of_06162017,tags,transcript,notes
2733,Amy Green,A video game to cope with grief,http://www.ted.com/talks/view/id/2733,"When Amy Green's young son was diagnosed with a rare brain tumor, she made up a bedtime story for his siblings to teach them about cancer. What resulted was a video game, ""That Dragon, Cancer,"" which takes players on a journey they can't win. In this beautiful talk about coping with loss, Green brings joy and play to tragedy. ""We made a game that's hard to play,"" she says, ""because the hardest moments of our lives change us more than any goal we could ever accomplish.""",http://www.ted.com/talks/view/id/2731/transcript?language=en,2,2017,TEDNYC,0:10:34,4/19/17,839577,"death,gaming,art,cancer,collaboration,communication,parenting,children,life,technology,humanity","0:11


Two months ago, my kids and I
huddled around a cell phone
watching the live stream
of the Game Awards,
one of the video game
industry's biggest nights.
They announced the nominees
for the Game for Impact,
an award that's given
to a thought-provoking video game
with a profound prosocial
message or meaning.
They opened the envelope
and they read the title of our video game.
An award ...
for impact.
It was almost funny, actually,
because I always thought
that winning an award like that
would have this huge impact on my life,
but I found that the opposite is true.




 0:50


The big nights,
the accomplishments 
they fade.
But the hardest nights of my life
have stuck with me,
impacting who I am
and what I do.




 1:04


In 2010, my third son, Joel, was diagnosed
with a rare and aggressive brain tumor.
And before that year was finished,
doctors sat my husband and I down
and let us know
that his tumor had returned
despite the most aggressive chemotherapy
and radiation that they could offer him.
On that terrible night,
after learning that Joel
had perhaps four months to live,
I cuddled up with
my two older sons in bed 
they were five and three at the time 
and I never really knew
how much they understood,
so I started telling them a bedtime story.
I told them about this
very brave knight named Joel
and his adventure fighting
a terrible dragon called cancer.
Every night, I told them
more of the story,
but I never let the story end.
I was just building up a context
that they could understand
and hoping that our prayers
would be answered
and I would never
have to tell them that that knight,
who had fought so bravely,
was done fighting
and could rest now, forever.




 2:13


Fortunately, I never did have to
finish that bedtime story.
My children outgrew it.
Joel responded better than anyone expected
to palliative treatment,
and so instead of months,
we spent years learning how to love
our dying child with all of our hearts.
Learning to recognize
that shameful feeling
of holding back just a little love
to try to spare ourselves
just a little pain
somewhere further down the road.
We pushed past that self-preservation
because Joel was worth loving
even if that love could crush us.
And that lesson of intense
vulnerability has changed me ...
more than any award ever could.




 3:01


We started living like Joel could live,
and we began developing a video game
called ""That Dragon, Cancer.""
It was the story of Joel.
It was the story of hope
in the shadow of death.
It was the story of faith
and doubt,
and the realization that a wrestle
with doubt is a part of faith 
maybe the biggest part of it.
It was a story that began as a miracle
and ended as a memorial.




 3:36


(Music)




 3:38


(Giggle)




 3:40


(Clapping)




 3:41


(Music)




 3:45


(Video) Dad: Bouncing around,
do you like that?




 3:48


(Giggle)




 3:49


I love your giggle.




 3:50


(Music)




 3:57


(Giggle)




 4:00


[A Journey of Hope In the Shadow of Death]




 4:06


[That Dragon, Cancer]




 4:09


(Music)




 4:14


When you play ""That Dragon, Cancer,""
you're transformed
into a witness of Joel's life,
exploring an emotional landscape,
clicking to discover more of what
we as a family felt and experienced.
It feels a little bit
like analyzing interactive poetry
because every game mechanic is a metaphor,
and so the more the player asks themselves
what we as designers
were trying to express and why,
the richer the experience becomes.




 4:44


We took that vulnerability
that Joel taught us,
and we encoded the game with it.
Players expect their video games
to offer them branching narrative
so that every decision
that they make feels important
and can change the outcome of the game.
We subverted that principle
of game design,
collapsing the choices in on the player
so that they discover for themselves
that there is nothing that they can do
that will change the outcome for Joel.
And they feel that discovery
as deeply and desperately as we felt it
on nights when we held Joel
in our arms praying for hours,
stubbornly holding out hope for a grace
that we could not create for ourselves.




 5:29


We'd all prefer to win,
but when you discover that you can't win,
what do you value instead?




 5:38


I never planned to write video games,
but these moments
that really change our lives,
they often come as the result
of our hardship  and not our glory.
When we thought that Joel could live,
I left the game designing to my husband.
I chimed in here and there
with a scene or two and some suggestions.
But after the night that Joel died,
the passion,
the possibility of sharing Joel's life
through our video game 
it was something that I couldn't resist.
I started writing more,
I sat in on our team's design meetings,
I added more ideas
and I helped direct scenes.
And I discovered that creating
a video game is telling a story,
but with an entirely new vocabulary.
All the same elements of imagination
and symbolism are there,
but they're just partnered
with player agency
and system responsiveness.
It's challenging work.
I have to think
in a totally new way to do it,
but I love it.
And I wouldn't have known
that without Joel.




 6:45


Maybe you're a little surprised
by our choice to share our story
of terminal cancer through a video game.
Perhaps you're even thinking
like so many people before you:
cancer is not a game.
Well, tell that
to any pediatric cancer parent
that's ever taken an exam glove
and blown it up into a balloon,
or transformed a syringe
into a rocket ship,
or let their child ride their IV pole
through the hospital halls
like it was a race car.
Because when you have children,
everything is a game.
And when your young child
experiences something traumatic,
you work even harder to make sure
that their life feels like a game
because children naturally
explore their worlds through play.
While cancer can steal
many things from a family,
it shouldn't steal play.




 7:38


If you're listening to me
and you're trying to imagine this family
that revolves entirely
around a dying child,
and you can't imagine joy
as part of that picture,
then we were right
to share our story with you,
because that season of our life was hard.
Unspeakably hard at times,
but it was also pure hope,
deep love
and joy like I have never
experienced since.
Our video game was our attempt
to share that world
with people who hadn't
experienced it before,
because we never could imagine
that world until it became ours.




 8:20


We made a video game that's hard to play.
It will never be a blockbuster.
People have to prepare themselves
to invest emotionally
in a story that they know
will break their hearts.
But when our hearts break,
they heal a little differently.
My broken heart has been healing
with a new and a deeper compassion 
a desire to sit with people in their pain,
to hear their stories
and try to help tell them
so that they know that they're seen.




 8:55


On the night when ""That Dragon, Cancer""
won the Game for Impact Award,
we cheered,
we smiled and we talked about Joel
and the impact he had on our life 
on all of those hard and hopeful nights
that we shared with him
when he changed our hearts
and taught us so much more
about life and love and faith and purpose.
That award will never mean as much to me
as even a single photograph of my son,
but it does represent all of the people
who his life has impacted,
people I'll never meet.
They write me emails sometimes.
They tell me that they miss Joel,
even though they never met him.
They describe the tears
that they've shed for my son,
and it makes my burden of grief
just a little bit lighter
knowing that it's shared
with a 10-year-old
watching a YouTube playthrough,
or a doctor playing on his airplane
with a smartphone,
or a professor introducing Joel
to her first-year philosophy students.




10:05


We made a video game that's hard to play.
But that feels just right to me,
because the hardest moments of our lives
change us more than any goal
we could ever accomplish.
Tragedy has shifted my heart
more than any dream
I could ever see come true.




10:27


Thank you.




10:28


(Applause)",
2734,Siamak Hariri,How do you build a sacred space?,http://www.ted.com/talks/view/id/2734,"To design the Bah' Temple of South America, architect Siamak Hariri focused on illumination -- from the temple's form, which captures the movement of the sun throughout the day, to the iridescent, luminous stone and glass used to construct it. Join Hariri for a journey through the creative process, as he explores what makes for a sacred experience in a secular world.",http://www.ted.com/talks/view/id/2730/transcript?language=en,3,2017,TEDNYC,0:12:46,4/17/17,796836,"architecture,art,materials,public spaces,collaboration,community,faith,religion,technology,design,engineering,innovation,society","0:11


The school of architecture
that I studied at some 30 years ago
happened to be across the street
from the wonderful art gallery
designed by the great
architect Louis Kahn.
I love the building,
and I used to visit it quite often.
One day,
I saw the security guard run his hand
across the concrete wall.
And it was the way he did it,
the expression on his face 
something touched me.
I could see that the security guard
was moved by the building
and that architecture has that capacity
to move you.
I could see it, and I remember thinking,
""Wow. How does architecture do that?""




 1:02


At school, I was learning to design,
but here  here was
a reaction of the heart.
And it touched me to the core.




 1:16


You know, you aspire for beauty,
for sensuousness, for atmosphere,
the emotional response.
That's the realm of the ineffable
and the immeasurable.
And that's what you live for:
a chance to try.




 1:38


So in 2003, there was
an open call for designs
for the Bah' Temple for South America.
This was the first temple
in all of South America.
It's a continental temple,
a hugely important milestone
for the Bah' community,
because this would be the last
of the continental temples
and would open the door
for national and local temples to be built
around the world.




 2:01


And the brief was deceptively simple
and unique in the annals of religion:
a circular room, nine sides,
nine entrances, nine paths,
allowing you to come to the temple
from all directions,
nine symbolizing completeness,
perfection.
No pulpit, no sermons,
as there are no clergy
in the Bah' faith.
And in a world which is putting up walls,
the design needed to express in form
the very opposite.
It had to be open, welcoming
to people of all faiths,
walks of life, backgrounds,
or no faith at all;
a new form of sacred space
with no pattern
or models to draw from.
It was like designing one of the first
churches for Christianity
or one of the first mosques for Islam.




 3:13


So we live in a secular world.
How do you design sacred space today?
And how do you even define
what's sacred today?




 3:32


I stumbled across this beautiful quote
from the Bah' writings,
and it speaks to prayer.
It says that if you reach out in prayer,
and if your prayer is answered 
which is already very interesting 
that the pillars of your heart
will become ashine.




 3:53


And I loved this idea
of the inner and the outer,
like when you see someone
and you say, ""That person is radiant.""
And I was thinking, ""My gosh,
how could we make something
architectural out of that,
where you create a building
and it becomes alive with light?
Like alabaster, if you kiss it with light,
it becomes alive.
And I drew this sketch,
something with two layers, translucent
with structure in between capturing light.
Maybe a pure form,
a single form of emanation
that you could imagine
would be all dome
and everything we kept making
was looking too much like an egg.




 4:47


(Laughter)




 4:48


A blob.




 4:50


So you search.
You all know this crazy search,
letting the process take you,
and you live for the surprises.
And I remember quite by accident
I saw this little video
of a plant moving in light,
and it made me think of movement,
reach,
this idea that the temple
could have reach,
like this reach for the divine.
You can imagine also
that movement within a circle
could mean movement and stillness,
like the cosmos,
something you see in many places.




 5:28


(Laughter)




 5:31


But rotation was not enough,
because we needed a form.
In the Bah' writings, it talks about
the temples being as perfect
as is humanly possible,
and we kept thinking,
well, what is perfection?
And I remember I stumbled into this image
of this Japanese basket
and thinking our Western notions
of perfection need to be challenged,
that this wonderful silhouette
of this basket, this wonkiness,
and that it has the kind of dimple
of what you might imagine a shoulder
or the cheekbone,
and that kind of organic form.
And so we drew and made models,
these lines that merge at the top,
soft lines,
which became like drapery
and translucent veils and folding,
and the idea of not only
folding but torquing 
you remember the plant
and the way it was reaching.
And this started to become
an interesting form,
carving the base, making the entrances.




 6:40


And then we ended up with this.
This is this temple with two layers,
nine luminous veils,
embodied light,
soft-flowing lines
like luminescent drapery.
180 submissions
were received from 80 countries,
and this was selected.




 7:01


So we went to the next stage
of how to build it.
We had submitted alabaster.
But alabaster was too soft,
and we were experimenting,
many experiments with materials,
trying to think how we could have
this kind of shimmer,
and we ended up with borosilicate.
And borosilicate glass,
as you know, is very strong,
and if you break borosilicate rods
just so and melt them
at just the right temperature,
we ended up with this new material,
this new cast glass which took us
about two years to make.
And it had this quality that we loved,
this idea of the embodied light,
but on the inside, we wanted
something with a soft light,
like the inner lining of a jacket.
On the outside you have protection,
but on the inside you touch it.
So we found this tiny vein
in a huge quarry in Portugal
with this beautiful stone,
which the owner had kept
for seven generations in his family,
waiting for the right project,
if you can believe it.
Look at this material, it's beautiful.
And the way it lights up;
it has that translucent quality.




 8:25


So here you see the structure.
It lets the light through.
And looking down,
the nine wings are bound,
structurally but symbolically strong,
a great symbol of unity:
pure geometry, a perfect circle,
30 meters in section and in plan,
perfectly symmetrical,
like the idea of sacredness and geometry.
And here you see the building going up,
2,000 steel nodes,
9,000 pieces of steel,
7,800 stone pieces,
10,000 cast glass pieces,
all individual shapes,
the entire superstructure all described,
engineered, fabricated
with aerospace technology,
prefabricated machine to machine,
robotically,
a huge team effort, you can imagine,
of literally hundreds,
and within three percent
of our $30 million budget
set in 2006.




 9:37


(Applause)




 9:41


Nine wings bound together
forming a nine-pointed star,
and the star shape moving in space,
tracking the sun.




10:06


So here it is.




10:08


Audience: Wow!




10:10


(Applause)




10:18


Hopefully, a befitting response
to that beautiful quote,
""a prayer answered,""
open in all directions,
capturing the blue light of dawn,
tent-like white light of day,
the gold light of the afternoon,
and of course, at night, the reversal:
sensuous,
catching the light in all kinds
of mysterious ways.




10:52


And the site: it's interesting;
14 years ago when we made the submission,
we showed the temple
set against the Andes.
We didn't have the Andes as our site,
but after nine years, that's exactly
where we ended up,
the lines of the temple set against
nothing but pure nature,
and you turn around and you get
nothing but the city below you,
and inside, a view in all directions,
radiating gardens
from each of the alcoves,
radiating paths.




11:35


Last October, the opening ceremonies 
a beautiful, sacred event,
5,000 people from 80 countries,
a continuous river of visitors,
indigenous people
from all over South America,
some who had never left their villages.
And of course, that this temple
belongs to people,
the collective, of many cultures
and walks of life,
many beliefs,
and for me, what's most important
is what it feels like on the inside;
that it feel intimate,
sacred,
and that everyone is welcome.
And if even a few who come
have the same reaction
as that security guard,
then it truly would be their temple.
And I would love that.




12:37


Thank you.




12:39


(Applause)",
2737,Stephanie Busari,How fake news does real harm,http://www.ted.com/talks/view/id/2737,"On April 14, 2014, the terrorist organization Boko Haram kidnapped more than 200 schoolgirls from the town of Chibok, Nigeria. Around the world, the crime became epitomized by the slogan #BringBackOurGirls -- but in Nigeria, government officials called the crime a hoax, confusing and delaying efforts to rescue the girls. In this powerful talk, journalist Stephanie Busari points to the Chibok tragedy to explain the deadly danger of fake news and what we can do to stop it.",http://www.ted.com/talks/view/id/2736/transcript?language=en,2,2017,TEDLagos Ideas Search,0:06:26,4/24/17,715340,"Africa,terrorism,trafficking,community,global issues,communication,writing,journalism,social change,humanity,society","0:12


I want to tell you a story about a girl.
But I can't tell you her real name.
So let's just call her Hadiza.




 0:20


Hadiza is 20.
She's shy,
but she has a beautiful smile
that lights up her face.
But she's in constant pain.
And she will likely be on medication
for the rest of her life.




 0:36


Do you want to know why?
Hadiza is a Chibok girl,
and on April 14, 2014, she was kidnapped
by Boko Haram terrorists.
She managed to escape, though,
by jumping off the truck
that was carrying the girls.
But when she landed,
she broke both her legs,
and she had to crawl on her tummy
to hide in the bushes.
She told me she was terrified
that Boko Haram would come back for her.
She was one of 57 girls who would escape
by jumping off trucks that day.




 1:09


This story, quite rightly, caused ripples
around the world.
People like Michelle Obama,
Malala and others
lent their voices in protest,
and at about the same time 
I was living in London at the time 
I was sent from London to Abuja
to cover the World Economic Forum
that Nigeria was hosting
for the first time.
But when we arrived, it was clear
that there was only one story in town.
We put the government under pressure.
We asked tough questions
about what they were doing
to bring these girls back.
Understandably,
they weren't too happy
with our line of questioning,
and let's just say we received
our fair share of ""alternative facts.""




 1:49


(Laughter)




 1:52


Influential Nigerians
were telling us at the time
that we were nave,
we didn't understand
the political situation in Nigeria.
But they also told us
that the story of the Chibok girls
was a hoax.
Sadly, this hoax narrative has persisted,
and there are still people
in Nigeria today
who believe that the Chibok girls
were never kidnapped.
Yet I was talking to people like these 
devastated parents,
who told us that on the day
Boko Haram kidnapped their daughters,
they ran into the Sambisa Forest
after the trucks carrying their daughters.
They were armed with machetes,
but they were forced to turn back
because Boko Haram had guns.




 2:38


For two years, inevitably,
the news agenda moved on,
and for two years,
we didn't hear much
about the Chibok girls.
Everyone presumed they were dead.
But in April last year,
I was able to obtain this video.
This is a still from the video
that Boko Haram filmed as a proof of life,
and through a source,
I obtained this video.
But before I could publish it,
I had to travel
to the northeast of Nigeria
to talk to the parents, to verify it.
I didn't have to wait
too long for confirmation.
One of the mothers,
when she watched the video, told me
that if she could have reached
into the laptop
and pulled our her child from the laptop,
she would have done so.
For those of you who are parents,
like myself, in the audience,
you can only imagine the anguish
that that mother felt.




 3:36


This video would go on to kick-start
negotiation talks with Boko Haram.
And a Nigerian senator told me
that because of this video
they entered into those talks,
because they had long presumed
that the Chibok girls were dead.
Twenty-one girls were freed
in October last year.
Sadly, nearly 200 of them
still remain missing.




 4:02


I must confess that I have not been
a dispassionate observer
covering this story.
I am furious when I think
about the wasted opportunities
to rescue these girls.
I am furious when I think about
what the parents have told me,
that if these were daughters
of the rich and the powerful,
they would have been found much earlier.
And I am furious
that the hoax narrative,
I firmly believe,
caused a delay;
it was part of the reason
for the delay in their return.




 4:37


This illustrates to me
the deadly danger of fake news.
So what can we do about it?
There are some very smart people,
smart engineers at Google and Facebook,
who are trying to use technology
to stop the spread of fake news.
But beyond that, I think
everybody here  you and I 
we have a role to play in that.
We are the ones who share the content.
We are the ones who share
the stories online.
In this day and age, we're all publishers,
and we have responsibility.




 5:12


In my job as a journalist,
I check, I verify.
I trust my gut, but I ask tough questions.
Why is this person telling me this story?
What do they have to gain
by sharing this information?
Do they have a hidden agenda?
I really believe that we must all start
to ask tougher questions
of information that we discover online.




 5:40


Research shows that some of us
don't even read beyond headlines
before we share stories.
Who here has done that?
I know I have.
But what if
we stopped taking information
that we discover at face value?
What if we stop to think
about the consequence
of the information that we pass on
and its potential to incite
violence or hatred?
What if we stop to think
about the real-life consequences
of the information that we share?




 6:19


Thank you very much for listening.




 6:20


(Applause)",
