id,speaker,headline,URL,description,transcript_URL,month_filmed,year_filmed,event,duration,date_published,views_as_of_06162017,tags,transcript,notes
2775,Karim Abouelnaga,A summer school kids actually want to attend,http://www.ted.com/talks/view/id/2775,"In the US, most kids have a very long summer break, during which they forget an awful lot of what they learned during the school year. This ""summer slump"" affects kids from low-income neighborhoods most, setting them back almost three months. TED Fellow Karim Abouelnaga has a plan to reverse this learning loss. Learn how he's helping kids improve their chances for a brighter future.",http://www.ted.com/talks/view/id/2774/transcript?language=en,4,2017,TED2017,0:07:05,5/5/17,621446,"education,social change,children,leadership,inequality,TED Fellows,teaching,society,personal growth","0:12


Getting a college education
is a 20-year investment.
When you're growing up poor,
you're not accustomed
to thinking that far ahead.
Instead, you're thinking about
where you're going to get your next meal
and how your family
is going to pay rent that month.
Besides, my parents
and my friends' parents
seemed to be doing just fine
driving taxis and working as janitors.
It wasn't until I was a teenager
when I realized I didn't
want to do those things.
By then, I was two-thirds of the way
through my education,
and it was almost too late
to turn things around.




 0:48


When you grow up poor,
you want to be rich.
I was no different.
I'm the second-oldest of seven,
and was raised by a single mother
on government aid
in Queens, New York.
By virtue of growing up low-income,
my siblings and I went
to some of New York City's
most struggling public schools.
I had over 60 absences
when I was in seventh grade,
because I didn't feel like going to class.
My high school had
a 55 percent graduation rate,
and even worse,
only 20 percent of the kids graduating
were college-ready.




 1:21


When I actually did make it to college,
I told my friend Brennan
how our teachers would always ask us
to raise our hands
if we were going to college.
I was taken aback when Brennan said,
""Karim, I've never been asked
that question before.""
It was always, ""What college
are you going to?""
Just the way that question is phrased
made it unacceptable for him
not to have gone to college.




 1:46


Nowadays I get asked a different question.
""How were you able to make it out?""
For years I said I was lucky,
but it's not just luck.
When my older brother and I
graduated from high school
at the very same time
and he later dropped out
of a two-year college,
I wanted to understand why he dropped out
and I kept studying.
It wasn't until I got to Cornell
as a Presidential Research Scholar
that I started to learn about
the very real educational consequences
of being raised by a single mother
on government aid
and attending the schools that I did.
That's when my older brother's trajectory
began to make complete sense to me.




 2:27


I also learned that our most admirable
education reformers,
people like Arne Duncan,
the former US Secretary of Education,
or Wendy Kopp, the founder
of Teach For America,
had never attended an inner city
public school like I had.
So much of our education reform
is driven by a sympathetic approach,
where people are saying,
""Let's go and help
these poor inner city kids,
or these poor black and Latino kids,""
instead of an empathetic approach,
where someone like me, who had grown up
in this environment, could say,
""I know the adversities that you're facing
and I want to help you overcome them.""




 3:02


Today when I get questions
about how I made it out,
I share that one of the biggest reasons
is that I wasn't ashamed to ask for help.
In a typical middle class
or affluent household,
if a kid is struggling,
there's a good chance that a parent
or a teacher will come to their rescue
even if they don't ask for help.
However, if that same kid
is growing up poor
and doesn't ask for help,
there's a good chance
that no one will help them.
There are virtually
no social safety nets available.




 3:32


So seven years ago,
I started to reform
our public education system
shaped by my firsthand perspective.
And I started with summer school.
Research tells us that two-thirds
of the achievement gap,
which is the disparity
in educational attainment
between rich kids and poor kids
or black kids and white kids,
could be directly attributed
to the summer learning loss.
In low-income neighborhoods,
kids forget almost three months
of what they learned
during the school year
over the summer.
They return to school in the fall,
and their teachers
spend another two months
reteaching them old material.
That's five months.
The school year in the United States
is only 10 months.
If kids lose five months of learning
every single year,
that's half of their education.
Half.




 4:19


If kids were in school over the summer,
then they couldn't regress,
but traditional summer school
is poorly designed.
For kids it feels like punishment,
and for teachers
it feels like babysitting.
But how can we expect principals
to execute an effective summer program
when the school year
ends the last week of June
and then summer school starts
just one week later?
There just isn't enough time
to find the right people,
sort out the logistics,
and design an engaging curriculum
that excites kids and teachers.




 4:50


But what if we created a program
over the summer
that empowered teachers
as teaching coaches
to develop aspiring educators?
What if we empowered
college-educated role models
as teaching fellows
to help kids realize
their college ambitions?
What if empowered high-achieving kids
as mentors to tutor their younger peers
and inspire them
to invest in their education?
What if we empowered all kids as scholars,
asked them what colleges
they were going to,
designed a summer school
they want to attend
to completely eliminate
the summer learning loss
and close two-thirds
of the achievement gap?




 5:36


By this summer, my team will have served
over 4,000 low-income children,
trained over 300 aspiring teachers
and created more than 1,000 seasonal jobs
across some of New York City's
most disadvantaged neighborhoods.




 5:50


(Applause)




 5:55


And our kids are succeeding.
Two years of independent evaluations
tell us that our kids
eliminate the summer learning loss
and make growth of one month in math
and two months in reading.
So instead of returning to school
in the fall three months behind,
they now go back four months ahead in math
and five months ahead in reading.




 6:16


(Applause)




 6:23


Ten years ago, if you would have told me
that I'd graduate in the top 10 percent
of my class from an Ivy League institution
and have an opportunity to make a dent
on our public education system
just by tackling two months
of the calendar year,
I would have said,
""Nah. No way.""
What's even more exciting
is that if we can prevent
five months of lost time
just by redesigning two months,
imagine the possibilities
that we can unlock
by tackling the rest of the calendar year.




 6:57


Thank you.




 6:58


(Applause)",
2777,Jorge Drexler,"Poetry, music and identity",http://www.ted.com/talks/view/id/2777,"One night in 2002, a friend gave Jorge Drexler the chorus to a song and challenged him to write the rest of it using a complex, poetic form known as the ""Dcima."" In this fascinating talk, Drexler examines the blended nature of identity, weaving together the history of the Dcima with his own quest to write one. He closes the talk with a performance of the resulting song, ""La Milonga del Moro Judo."" (In Spanish with English subtitles)",http://www.ted.com/talks/view/id/2739/transcript?language=en,4,2017,TED2017,0:16:40,5/10/17,396288,"culture,performance,creativity,history,language,live music,guitar,composing,Latin America,world cultures,identity,South America,TED en Espaol,poetry,entertainment,music,humanity","0:12


I'm going to tell you the story of a song.
I was in Madrid one night in 2002
with my teacher and friend Joaqun Sabina,
when he said he had something to give me.
He said,
""Jorge, I have some lines
that you need to put into a song.
Take these down, take these down.""
I looked on the table but all I found
was a circular coaster,
on which I wrote the lines
my teacher dictated.
They were four lines that went like this:




 0:38


""I am a Jewish Moor
living among Christians
I don't know who my God is,
nor who my brothers are.""




 0:47


Those lines really made
an impression on me.
I said, ""What beautiful lyrics,
Joaqun. Did you write them?""
He said no, they were by another composer
named Chicho Snchez Ferlosio,
who was less known than Joaqun,
but also a great poet.
These lines came to me at a time
where I had been wanting
to express something for a while,
but didn't quite know how.




 1:08


I was getting up to leave
and go home to write,
when Joaqun stopped me
and said, ""Hang on, hang on,""
and presented me with this challenge:
""Write the stanzas for this song
in Dcimas.""
Now, at this point in my life,
I still wasn't completely
sure what Dcimas were,
but I was too embarrassed
to tell my teacher I didn't know.
So I put on my best
""Yeah, I totally understand"" face,
and went home to look up
what Dcimas were.
I learned that a Dcima is a type of verse
that only exists in Spanish,
and that it has 10 lines.
It's very, very complex 
perhaps the most complex style of stanza
that we have in Spanish.
It also has a very concrete
date of origin,
which is very rare for a style of stanza.




 1:55


The Dcima was invented in Spain in 1591,
by a guy named Vicente Espinel,
a musician and poet from Mlaga.
And listen to this coincidence:
he was the same guy
who added the sixth string
to what would later be called
the Spanish guitar.
This string right here 
it's called the ""bordona.""




 2:17


From Spain, the Dcima, with its 10 lines,
crosses over to America,
just like the Spanish guitar,
but in contrast to the Dcima,
the Spanish guitar continues to live today
on both sides of the Atlantic.
But the Dcima, in Spain, its birthplace,
disappeared; it died out.
It died out about 200 years ago,
and yet in Latin America,
from Mexico to Chile,
all our countries maintain
some form of the Dcima
in our popular traditions.




 2:51


In each place, they've given it
a different name,
and set it to different music.
It has a lot of different names 
more than 20 in total on the continent.
In Mexico, for example,
it's called the ""Son Jarocho,""
""Canto de mejorana"" in Panama;
""Galern"" in Venezuela;
""Payada"" in Uruguay and Argentina;
""Repentismo"" in Cuba.
In Peru, they call it the Peruvian Dcima,
because the Dcima becomes
so integrated into our traditions,
that if someone asks, people
from each place are completely convinced
that the Dcima was invented
in their country.




 3:23


(Laughter)




 3:24


It's also got a really surprising feature,
which is that despite the fact
that it developed independently
in each of the different countries,
it maintains even today,
400 years after its creation,
exactly the same rhyme,
syllable and line structure 
the same structure Vicente Espinel gave it
during the Spanish Baroque period.
Here's the structure 
I'll give you the basic idea
and then later you can look online
and learn more about it.




 3:54


The Dcima is ten lines long;
each line has eight syllables.
The first line rhymes
with the fourth and the fifth;
the second line, with the third;
the sixth line,
with the seventh and the tenth;
and the eighth line rhymes with the ninth.
It's a bit complicated, to be honest.
And me  imagine me,
trying to write in Dcimas.
But it's not as complicated as it seems.
Plus, it's amazing that it's survived
with the same structure
for more than four centuries.
It's not that complicated, because it has
an impressive musicality to it,
a type of musicality
that's very hard to describe technically.
I prefer that you listen to it.
So I'm going to recite a Dcima,
one of the Dcimas
that I wrote for this song.
I'm going to ask that you concentrate
just on the musicality of the rhymes.
For those of you with headphones on 
I see that some of you are listening
to the translation 
please take them off for a minute.




 4:58


(English) Take your headphones off,
it you have them.




 5:02


(English) Forget about the meaning
of the words for a few seconds,




 5:08


(English) and then you'll put them back.




 5:10


(English) Forget about the structure.




 5:12


(Spanish) Forget about the structure.




 5:14


(English) And just ... it's all about
the choreography of sound of the Dcima.




 5:19


(Spanish) A choreography of sound.




 5:23


(Sings in Spanish) ""There is not one death
that does not cause me pain,
there are no winners,
heres nothing but suffering
and another life blown away.
War is a terrible school
no matter what the disguise,
forgive me for not enlisting
under any flag,
any daydream is worth more
than a sad piece of cloth.""




 5:45


That's a Dcima.




 5:47


(English) You can put
your headphones back on.




 5:49


(Applause)




 5:50


(English) Thank you.




 5:51


(Applause)




 5:56


I also applaud Vicente Espinel,
because here it is 426 years later,
and the Dcima lives on everywhere
in its original state.




 6:02


I wrote three like that one;
you just heard the second.
I wrote the first one having only
recently learned how,
and it has some errors in terms of meter,
so it's not presentable
in its current state.
But the one I sang was good, more or less.
So: What was it about?
What was the meaning behind those lines?




 6:20


I had just returned from doing
a concert in Israel,
and I was very emotional over a problem
that hits really close to home,
which is the Israeli-Palestinian conflict.
I'll explain: my dad's family is Jewish,
and my mom's family
are non-practicing Christians.
I was raised in a home
where the two traditions lived together
more or less in harmony.
It wasn't unusual to see my Jewish grandpa
dressed as Santa Claus, for example,
or to see my non-Jewish grandpa
at the synagogue wearing his kippah,
at family celebrations, wearing the same
expression that I probably had
when Sabina told me 




 6:55


(Laughter)




 6:56


that he had some Dcima lines for me.
For someone raised
in that kind of environment,
it's especially painful to see
the difficulty the opposing parties have
in putting themselves in the other
side's shoes even for a moment.
So that's what I wrote about.




 7:15


I already had the lyrics,
I had the form  the Dcima 
and the content.
I needed to write the music.
I'll give you some context.
I had only recently moved from Uruguay,
where I'm from, to Spain.
And I was feeling very raw with nostalgia,
like many of you here,
who are away from home.
And I wanted my song
to be very, very Uruguayan,
the most Uruguayan type of song
there is  the milonga.
So now, I had been studying the Dcima,
and after finding out
that everyone tried to claim
the Dcima as their own,
that it was invented in their country,
it made me wonder:
What does it mean when we say
the milonga is Uruguayan?




 7:57


The milonga has a rhythmic pattern
that we musicians call 3-3-2.




 8:03


(Counts out the beats) One two three,
one two three, one two.




 8:10


And it has a characteristic emphasis.




 8:13


(Sings)




 8:21


But this characteristic rhythm pattern
comes from Africa.
In the ninth century you could find it
in the brothels of Persia,
and in the thirteenth,
in Spain, from where,
five centuries later,
it would cross over to America
with the African slaves.
Meanwhile, in the Balkans,
it encounters the Roma scale 




 8:43


(Sings)




 8:50


which in part, gives birth
to klezmer music,
which Ukrainian Jewish immigrants
bring to Brooklyn, New York.
They sing it in their banquet halls.




 9:01


(Sings ""Hava Nagila"")




 9:08


And their neighbor,
an Argentine kid of Italian origin
named Astor Piazzolla,
hears it,
assimilates it
and transforms the tango
of the second half of the 20th century
with his ...




 9:21


(Counts out the beats) One two three,
one two three, one two.




 9:25


(Sings ""Adios Nonino"")




 9:33


He also played it on his bandoneon,
a 19th-century German instrument
created for churches
that weren't allowed to buy organs,
and that ends up, incredibly,
in Ro de la Plata,
forming the very essence
of the tango and the milonga,
in the very same way another instrument
just as important as the bandoneon did:
the Spanish guitar.




 9:55


(Applause)




10:07


To which, by the way,
Vicente Espinel, in the 16th century,
added a sixth string.
It's amazing how all these things
are coming full circle.




10:14


What have I learned in these 15 years
since the song was born
from going all over the world
with four lines written on a coaster
from a bar in Madrid?
That Dcimas,
the milonga,
songs, people 
the closer you get to them,
the more complex their identity becomes,
and the more nuances and details appear.
I learned that identity
is infinitely dense,
like an infinite series of real numbers,
and that even if you get very close
and zoom in,
it never ends.




10:49


Before I sing you a song and say goodbye,
allow me to tell you one last story.
Not long ago, we were in Mexico
after a concert.
And since the concert promoters know me,
they knew I was a Dcima freak
and that everywhere I go I ask about it,
insisting on hearing Dcima artists.
So they organized a son jarocho show
for me at their house.
If you recall, the son jarocho
is one of the styles of music
that uses Dcimas in its verses.




11:23


When these amazing musicians
finished playing
what is for me, something amazing,
which is the son jarocho,
they finished playing and were ...
I went up to greet them, really excited,
getting ready to thank them
for their gift of music,
and this young kid says to me 
and he says it with the best
of intentions  he says,
""We're very proud, sir, to be keeping
alive the purest origins
of our Mexican identity.""
And to tell you the truth,
I didn't really know what to say.




11:58


(Laughter)




11:59


I stood there looking at him.
I gave him a hug and left, but ...




12:02


(Laughter)




12:03


But he was right, too, though. Right?
In reality, the Dcima is its origin,
but at the same time,
just like in the milonga
and in the Dcima,
are the roots of many more cultures
from all over the place, like he said.




12:17


Later, when I got back to the hotel,
I thought about it for a while.
And I thought:
things only look pure
if you look at them from far away.
It's very important
to know about our roots,
to know where we come from,
to understand our history.
But at the same time, as important
as knowing where we're from,
is understanding that deep down,
we're all from nowhere
and a little bit from everywhere.




12:46


Thank you very much.




12:47


(Applause)




12:57


This is ""The milonga of the Jewish Moor.""




13:01


(Music)




13:13


(Sings)




13:15


For every wall a lament
in Jerusalem the golden




13:23


and 100 wasted lives
for every commandment.




13:30


I am dust in your wind
and although I bleed through your wound,




13:38


and every beloved stone
has my deepest affection,




13:44


there is not a stone in the world
worth more than a human life.




13:53


I am a Jewish Moor
who lives among Christians




14:00


I don't know who my God is,
nor who my brothers are.




14:09


I don't know who my God is,
nor who my brothers are.




14:18


There is not one death that does not
cause me pain, there are no winners




14:26


there's nothing but suffering
and another life blown away.




14:33


War is a terrible school
no matter what the disguise,




14:40


forgive me for not enlisting
under any flag,




14:47


any daydream is worth more
than a sad piece of cloth.




14:56


I am a Jewish Moor
who lives among Christians




15:03


I don't know who my God is,
nor who my brothers are.




15:11


I don't know who my God is,
nor who my brothers are.




15:24


And nobody has my permission
for killing in my name,




15:32


a man is but a man
and if there is a God, this was his wish,




15:39


the very ground I tread
will live on, once I am gone




15:46


on my way to oblivion, and all doctrines
will suffer the same fate,




15:53


and there is not one nation
that has not proclaimed itself




15:58


the chosen people.




16:02


I am a Jewish Moor
who lives among Christians




16:09


I don't know who my God is,
nor who my brothers are.




16:18


I don't know who my God is,
nor who my brothers are.




16:23


I am a Jewish Moor
who lives among Christians




16:31


(Applause)




16:32


Thank you.




16:33


(Applause)",
